{
  "schema_version": "0.1",
  "artifact_type": "research-output",
  "created": "2026-06-10",
  "target_outcome": "Discover traceable skill-audit capabilities, adjacent review surfaces, and raw signals for agent skills or method packages that a first-pass audit-skill search would likely miss.",
  "lane_id": "skill-audit",
  "lane_description": "Skill and package-method audit discovery lane. Source-code-only security audit, domain audit skills, marketplace ranking, install, and adoption decisions are adjacent lanes and should not be mixed into this pool.",
  "why_now": "Agent skill packages, SKILL.md linters, npm-distributed skill scanners, and adjacent agent security tools are appearing quickly in 2026, so discovery needs traceable candidates before any adoption or package-quality gate.",
  "find_stage_boundary": {
    "does": [
      "discovers multiple traceable skill-audit and adjacent package-review candidates",
      "records GitHub, npm, download, freshness, and source-gap raw signals",
      "keeps exact skill-quality candidates separate from adjacent security scanners",
      "records deferred boundaries for later adoption-stage review"
    ],
    "does_not": [
      "does not make adopt/use decisions",
      "does not recommend, approve, install, enable, configure, publish, deploy, login, execute, or mutate runtime config for any candidate",
      "does not perform source, safety, permission, maintenance, credential, browser, provider, live, or external-write audit",
      "does not choose a single winner"
    ]
  },
  "source_gaps": [
    "No public Codex/Claude/OpenClaw skill marketplace install-count API was used in this bounded run.",
    "GitHub API does not expose true 7/30/90-day star velocity in the queried metadata; recent growth proxy uses created/updated/pushed dates plus current stars/forks.",
    "npm search/download signals were sampled, not exhaustive across every package spelling.",
    "PyPI, Homebrew, VS Code/Cursor extension stores, and private agent-skill registries were not exhaustively searched in this bounded run.",
    "No candidate was installed or executed, so CLI behavior, output shape, and actual review coverage remain unverified.",
    "Full JSON Schema validation is separate from this red-line artifact check."
  ],
  "false_positives": [
    {
      "name": "AgriciDaniel/claude-ads",
      "source_url": "https://github.com/AgriciDaniel/claude-ads",
      "lane_id": "skill-audit",
      "why_false_positive": "High-star Claude skill with audit language, but it audits advertising accounts and campaigns, not candidate skills.",
      "could_be_valid_in_lanes": [
        "domain-marketing-audit"
      ],
      "query_correction": "Require candidate object terms such as SKILL.md, agent skill, skill package, capability adoption, scanner, linter, or quality gate."
    },
    {
      "name": "aaron-he-zhu/seo-geo-claude-skills",
      "source_url": "https://github.com/aaron-he-zhu/seo-geo-claude-skills",
      "lane_id": "skill-audit",
      "why_false_positive": "Contains technical audit skills, but the audited object is SEO/GEO content and sites, not skills or agent capability packages.",
      "could_be_valid_in_lanes": [
        "domain-seo-audit"
      ],
      "query_correction": "Exclude domain audit collections unless they inspect agent skills or SKILL.md packages."
    }
  ],
  "candidates": [
    {
      "candidate_id": "moonrunnerkc-skillcheck",
      "name": "moonrunnerkc/skillcheck",
      "source": {
        "source_family": "source-repositories",
        "source_url": "https://github.com/moonrunnerkc/skillcheck",
        "repo_url": "https://github.com/moonrunnerkc/skillcheck"
      },
      "entrypoint_url": "https://github.com/moonrunnerkc/skillcheck",
      "candidate_type": "cli",
      "candidate_role": "capability",
      "candidate_surfaces": [
        "agent-skill",
        "cli",
        "source-repo"
      ],
      "target_outcome": "Cross-agent quality gate for SKILL.md files with frontmatter, discoverability, file reference, token budget, and compatibility checks.",
      "outcome_mode": "static SKILL.md quality/lint gate",
      "query_branch": "skill-native",
      "metrics": {
        "installs": null,
        "stars": 14,
        "forks": 1,
        "star_velocity": {
          "days_7": null,
          "days_30": null,
          "days_90": null
        },
        "recent_growth_proxy": {
          "basis": [
            "created 2026-03-11",
            "pushed 2026-06-08",
            "14 stars",
            "1 fork"
          ],
          "summary": "Exact outcome match with recent push, but weak distribution signal."
        },
        "first_seen": "2026-03-11",
        "last_update": "2026-06-08"
      },
      "find_signals": [
        "Description explicitly targets SKILL.md quality gates.",
        "Mentions Claude Code, VS Code/Copilot, Codex, and Cursor compatibility.",
        "Includes progressive disclosure and token-budget language aligned with skill-audit concerns."
      ],
      "signal_completeness": "medium",
      "false_positive_note": null,
      "deferred_boundary_tags": [
        "source-review-needed",
        "install-boundary",
        "cli-execution-boundary",
        "quality-coverage-validation-needed"
      ],
      "notes": [
        "Exact GitHub hit in this bounded run.",
        "Find-stage records the candidate and raw review-surface signals only."
      ]
    },
    {
      "candidate_id": "joeynyc-skillscore",
      "name": "joeynyc/skillscore",
      "source": {
        "source_family": "package-registries",
        "source_url": "https://github.com/joeynyc/skillscore",
        "repo_url": "https://github.com/joeynyc/skillscore"
      },
      "entrypoint_url": "https://www.npmjs.com/package/skillscore",
      "candidate_type": "cli",
      "candidate_role": "capability",
      "candidate_surfaces": [
        "cli",
        "package",
        "source-repo"
      ],
      "target_outcome": "Evaluate AI agent skills and produce quality scores for SKILL.md-based skills from skills.sh, ClawHub, GitHub, or local directories.",
      "outcome_mode": "skill quality scoring CLI",
      "query_branch": "package-cli",
      "metrics": {
        "installs": 66,
        "download_signals": [
          {
            "source": "npm downloads API",
            "period": "2026-05-04..2026-06-02",
            "count": 66,
            "source_url": "https://api.npmjs.org/downloads/point/last-month/skillscore",
            "note": "Last-month package downloads; not equivalent to active users."
          }
        ],
        "stars": 13,
        "forks": 1,
        "star_velocity": {
          "days_7": null,
          "days_30": null,
          "days_90": null
        },
        "recent_growth_proxy": {
          "basis": [
            "repo created 2026-02-11",
            "npm created 2026-02-12",
            "latest npm 2.0.2 on 2026-03-13",
            "13 stars",
            "66 last-month npm downloads"
          ],
          "summary": "Outcome-adjacent skill scoring signal with package distribution and small download signal."
        },
        "first_seen": "2026-02-11",
        "last_update": "2026-06-01"
      },
      "find_signals": [
        "Explicitly evaluates AI agent skills and produces quality scores.",
        "Npm package exists with measurable downloads.",
        "Mentions multiple skill sources."
      ],
      "signal_completeness": "high",
      "false_positive_note": null,
      "deferred_boundary_tags": [
        "source-review-needed",
        "install-boundary",
        "scoring-validity-validation-needed",
        "license-review-needed"
      ],
      "notes": [
        "Retained because it has both GitHub and npm raw signals.",
        "Find-stage does not treat scoring claims as an approval verdict."
      ]
    },
    {
      "candidate_id": "nvidia-skillspector",
      "name": "NVIDIA/SkillSpector",
      "source": {
        "source_family": "source-repositories",
        "source_url": "https://github.com/NVIDIA/SkillSpector",
        "repo_url": "https://github.com/NVIDIA/SkillSpector"
      },
      "entrypoint_url": "https://github.com/NVIDIA/SkillSpector",
      "candidate_type": "repo-tool",
      "candidate_role": "capability",
      "candidate_surfaces": [
        "cli",
        "source-repo"
      ],
      "target_outcome": "Security scanner for AI agent skills that detects vulnerabilities, malicious patterns, and security risks.",
      "outcome_mode": "AI agent skill security scanner",
      "query_branch": "source-code",
      "metrics": {
        "installs": null,
        "stars": 1904,
        "forks": 160,
        "star_velocity": {
          "days_7": null,
          "days_30": null,
          "days_90": null
        },
        "recent_growth_proxy": {
          "basis": [
            "created 2026-03-21",
            "pushed 2026-06-10",
            "1904 stars",
            "160 forks",
            "NVIDIA org"
          ],
          "summary": "Large high-growth-looking security scanner signal with direct AI agent skill object."
        },
        "first_seen": "2026-03-21",
        "last_update": "2026-06-10"
      },
      "find_signals": [
        "Directly targets AI agent skills.",
        "High stars/forks relative to exact quality tools.",
        "Recent push on search date."
      ],
      "signal_completeness": "medium",
      "false_positive_note": "Adjacent: security scanner, not quality/effectiveness evaluator.",
      "deferred_boundary_tags": [
        "security-scan-lane",
        "source-review-needed",
        "install-boundary",
        "license-review-needed"
      ],
      "notes": [
        "Recorded as an adjacent risk-surface candidate for later boundary review.",
        "Not treated as a replacement for exact skill-quality review candidates."
      ]
    }
  ]
}
